{"advisory_build_action":"full","canonicalization":"rs-canonical-json-v1","changed_paths":[".gitattributes","AGENTS.md","RedSalamander/SelfTest/FileOperations/FolderWindow.FileOperations.Tests.Runner.cpp","RedSalamander/SelfTest/FileOperations/FolderWindow.FileOperations.Tests.VisualGallery.cpp","Specs/Plans/Done/FileOperations_DocumentationPrivacy_2026-10-19.md","Specs/Plans/WIP/ScreenshotSyntheticData_2026-10-19.md","Specs/Testing/Testing_SelfTests.md","docs/FileOperations.md","docs/res/file-operations-issues.png","docs/res/file-operations-issues.provenance.json","docs/res/file-operations-popup.png","docs/res/file-operations-popup.provenance.json"],"decision_digest":"36023de21ea6295be8aec6420af38d6ba07fa4d6ecc7be2259f8db1b88b39362","entries":[{"affected":true,"decision":"EXECUTE","estimated_duration_ms":667163,"expected_fingerprint":"1885586d0407c095afcca11e6ce11fcd6788e51d00fe1311b8e67fe4d7c978b7","id":"tooling.pester-build-toolchain","matched_impact_tags":["test.build","test.tooling"],"ordinal":0,"origin_evidence_digest":null,"origin_run_id":null,"reason_codes":["SOURCE_INPUT_CHANGED"]},{"affected":true,"decision":"EXECUTE","estimated_duration_ms":166143,"expected_fingerprint":"9e4dd9521b33e282f679f6a2e22d9e47d27c7cb9bcf279f0b9d9420ab1b378aa","id":"selftest.compare-directories","matched_impact_tags":["test.compare-directories","test.selftest"],"ordinal":1,"origin_evidence_digest":null,"origin_run_id":null,"reason_codes":["SOURCE_INPUT_CHANGED"]},{"affected":true,"decision":"EXECUTE","estimated_duration_ms":0,"expected_fingerprint":"ab5f244c06abb30023efe4eeafb296dac34e03933f3b594587bb1ef874a2f4d0","id":"standalone.product-ui","matched_impact_tags":["test.standalone"],"ordinal":2,"origin_evidence_digest":null,"origin_run_id":null,"reason_codes":["SOURCE_INPUT_CHANGED"]},{"affected":true,"decision":"EXECUTE","estimated_duration_ms":36205,"expected_fingerprint":"67c0d3f418b529836968c39a79a90925d64d55ce5acdc156343c5904030f9f7a","id":"viewer-pe.noninteractive","matched_impact_tags":["test.viewer-pe"],"ordinal":3,"origin_evidence_digest":null,"origin_run_id":null,"reason_codes":["SOURCE_INPUT_CHANGED"]},{"affected":true,"decision":"EXECUTE","estimated_duration_ms":9969,"expected_fingerprint":"85363b16d565d0a6d9f8fe70d990a80217b6643e942a3cf601e61598eb77dd32","id":"viewer-sqlite.noninteractive","matched_impact_tags":["test.viewer-sqlite"],"ordinal":4,"origin_evidence_digest":null,"origin_run_id":null,"reason_codes":["SOURCE_INPUT_CHANGED"]},{"affected":true,"decision":"EXECUTE","estimated_duration_ms":2518,"expected_fingerprint":"d3e56601a9ffaf9e9800ed61a081e3afdf8b10a5a61607f06582cdf3fe188f54","id":"standalone.filesystem-curl","matched_impact_tags":["test.standalone"],"ordinal":5,"origin_evidence_digest":null,"origin_run_id":null,"reason_codes":["SOURCE_INPUT_CHANGED"]},{"affected":true,"decision":"EXECUTE","estimated_duration_ms":7668,"expected_fingerprint":"baedd087fa2e44e31599141fd8676ef2c9490ecb08ff83d4140b891f722dfbd4","id":"standalone.monitor","matched_impact_tags":["test.standalone"],"ordinal":6,"origin_evidence_digest":null,"origin_run_id":null,"reason_codes":["SOURCE_INPUT_CHANGED"]},{"affected":true,"decision":"EXECUTE","estimated_duration_ms":2677,"expected_fingerprint":"63958b62eb0fdbac4c8dbb61538482d00f1eac4b246943a77cb13a937bdbb5c5","id":"standalone.localization","matched_impact_tags":["test.standalone"],"ordinal":7,"origin_evidence_digest":null,"origin_run_id":null,"reason_codes":["SOURCE_INPUT_CHANGED"]},{"affected":true,"decision":"EXECUTE","estimated_duration_ms":3206,"expected_fingerprint":"73c5f8e6bccd6c867640450ecc71a533f01aba8c939d4cc3477ab89ea8d21d05","id":"standalone.red-configure","matched_impact_tags":["test.standalone"],"ordinal":8,"origin_evidence_digest":null,"origin_run_id":null,"reason_codes":["SOURCE_INPUT_CHANGED"]},{"affected":true,"decision":"EXECUTE","estimated_duration_ms":24412,"expected_fingerprint":"128e228dc694e7611737c9b54e7f9052e8e02905e117fbf08d2fa163e3ecd3c7","id":"standalone.plugin-contract","matched_impact_tags":["test.standalone"],"ordinal":9,"origin_evidence_digest":null,"origin_run_id":null,"reason_codes":["SOURCE_INPUT_CHANGED"]},{"affected":true,"decision":"EXECUTE","estimated_duration_ms":2746,"expected_fingerprint":"981027be8ee3cf1f5395ed96708ff0285a1d4df57e72c43c5f5d18e18daef70e","id":"standalone.settings-schema","matched_impact_tags":["test.standalone"],"ordinal":10,"origin_evidence_digest":null,"origin_run_id":null,"reason_codes":["SOURCE_INPUT_CHANGED"]},{"affected":true,"decision":"EXECUTE","estimated_duration_ms":2550,"expected_fingerprint":"fba34c45401255744043103c9e7421b3937bfd2a5f43a66291b18b99a0242dc9","id":"standalone.crash-handling","matched_impact_tags":["test.standalone"],"ordinal":11,"origin_evidence_digest":null,"origin_run_id":null,"reason_codes":["SOURCE_INPUT_CHANGED"]},{"affected":true,"decision":"EXECUTE","estimated_duration_ms":28724,"expected_fingerprint":"6c307d7fbf3309addac677fa3de9d83eadb788a3ff5ed2f440fa7f150f94b399","id":"perf.performance-tests2","matched_impact_tags":["test.perf","test.performance"],"ordinal":12,"origin_evidence_digest":null,"origin_run_id":null,"reason_codes":["SOURCE_INPUT_CHANGED"]},{"affected":true,"decision":"EXECUTE","estimated_duration_ms":139402,"expected_fingerprint":"e61cc8999082b50d6111761bc1a79742b60f325d6bf8fb0934e45602bb6f77b5","id":"tooling.pester","matched_impact_tags":["test.tooling"],"ordinal":13,"origin_evidence_digest":null,"origin_run_id":null,"reason_codes":["SOURCE_INPUT_CHANGED"]},{"affected":true,"decision":"EXECUTE","estimated_duration_ms":2549,"expected_fingerprint":"f2c84d92f7909b4dbb31abf76f98d0e0f26d3e7db286292131d7eece9d7ad1bc","id":"tooling.vcpkg-merge-synthetic","matched_impact_tags":["test.tooling"],"ordinal":14,"origin_evidence_digest":null,"origin_run_id":null,"reason_codes":["SOURCE_INPUT_CHANGED"]}],"estimated_avoided_duration_ms":0,"estimated_executed_duration_ms":1095932,"estimated_fresh_duration_ms":1095932,"matched_impact_rules":["documentation.docs","documentation.specs","fallback.unknown","fileops.selftests"],"plan_digest":"95e7d963ce839033c1052333e03b351b84b89bb3d96d37651b1bdf5b252868bd","planner_mode":"shadow","schema":"red-salamander.validation-plan-decision.v1","snapshot_id":"a0d187d9d52dfdd77c0a929c642f7df5facdabda398ddd4542c94160da8109a8"}
