{"advisory_build_action":"full","canonicalization":"rs-canonical-json-v1","changed_paths":[".gitattributes","RedSalamander/SelfTest/FileOperations/FolderWindow.FileOperations.Tests.Runner.cpp","RedSalamander/SelfTest/FileOperations/FolderWindow.FileOperations.Tests.VisualGallery.cpp","Specs/Plans/WIP/FileOperations_DocumentationPrivacy_2026-10-19.md","Specs/Testing/Testing_SelfTests.md","docs/FileOperations.md"],"decision_digest":"f9bf99f072bbc0b80ba993166d9325a79b0f80d9a9e6d671f2ecbb59be6122a4","entries":[{"affected":true,"decision":"EXECUTE","estimated_duration_ms":667163,"expected_fingerprint":"456a7bacd15b73837ab67a245436213a2c80d28eddc53c02205666f580ddaa5e","id":"tooling.pester-build-toolchain","matched_impact_tags":["test.build","test.tooling"],"ordinal":0,"origin_evidence_digest":null,"origin_run_id":null,"reason_codes":["SOURCE_INPUT_CHANGED"]},{"affected":true,"decision":"EXECUTE","estimated_duration_ms":166143,"expected_fingerprint":"e58b53d2d375ed491e69a21a6d8d71fb4ba3c69c61c598a9c2c4f20aa0db2625","id":"selftest.compare-directories","matched_impact_tags":["test.compare-directories","test.selftest"],"ordinal":1,"origin_evidence_digest":null,"origin_run_id":null,"reason_codes":["SOURCE_INPUT_CHANGED"]},{"affected":true,"decision":"EXECUTE","estimated_duration_ms":0,"expected_fingerprint":"31b22446905bfa20884fd96b3000c6f252643e7f425d810c8f55086bba78498c","id":"standalone.product-ui","matched_impact_tags":["test.standalone"],"ordinal":2,"origin_evidence_digest":null,"origin_run_id":null,"reason_codes":["SOURCE_INPUT_CHANGED"]},{"affected":true,"decision":"EXECUTE","estimated_duration_ms":36205,"expected_fingerprint":"1f096ea7bc081a25b1413736e3815c163dd241917e15106eff339f5288fb7f5f","id":"viewer-pe.noninteractive","matched_impact_tags":["test.viewer-pe"],"ordinal":3,"origin_evidence_digest":null,"origin_run_id":null,"reason_codes":["SOURCE_INPUT_CHANGED"]},{"affected":true,"decision":"EXECUTE","estimated_duration_ms":9969,"expected_fingerprint":"8a6511f27a66c3de5a1a744251b4db3ec3947aa6cd0948c0edba1e471d9a4c75","id":"viewer-sqlite.noninteractive","matched_impact_tags":["test.viewer-sqlite"],"ordinal":4,"origin_evidence_digest":null,"origin_run_id":null,"reason_codes":["SOURCE_INPUT_CHANGED"]},{"affected":true,"decision":"EXECUTE","estimated_duration_ms":2518,"expected_fingerprint":"824b1a237c5c01d2f3e57d549d0091b93cf3f91c79e32e497a96c379a7b2f0f7","id":"standalone.filesystem-curl","matched_impact_tags":["test.standalone"],"ordinal":5,"origin_evidence_digest":null,"origin_run_id":null,"reason_codes":["SOURCE_INPUT_CHANGED"]},{"affected":true,"decision":"EXECUTE","estimated_duration_ms":7668,"expected_fingerprint":"a2a0241c65b1c1e993fa749b2f45ee81cbea9eab64a0d4fd6626d5eaeb0b2217","id":"standalone.monitor","matched_impact_tags":["test.standalone"],"ordinal":6,"origin_evidence_digest":null,"origin_run_id":null,"reason_codes":["SOURCE_INPUT_CHANGED"]},{"affected":true,"decision":"EXECUTE","estimated_duration_ms":2677,"expected_fingerprint":"7d741b7d2ef5db71a54c27eac3e5befde24f97b25f5afaf54f3a0dd6dabe422a","id":"standalone.localization","matched_impact_tags":["test.standalone"],"ordinal":7,"origin_evidence_digest":null,"origin_run_id":null,"reason_codes":["SOURCE_INPUT_CHANGED"]},{"affected":true,"decision":"EXECUTE","estimated_duration_ms":3206,"expected_fingerprint":"ec57aeed37cb8d0be19d1c740f58ec93d358a13f0170bd9ae0e0f73593256b86","id":"standalone.red-configure","matched_impact_tags":["test.standalone"],"ordinal":8,"origin_evidence_digest":null,"origin_run_id":null,"reason_codes":["SOURCE_INPUT_CHANGED"]},{"affected":true,"decision":"EXECUTE","estimated_duration_ms":24412,"expected_fingerprint":"1a3a1e674216e7b76981f5545d26819c5dc2e5f2c8e4f54603711691ebda1207","id":"standalone.plugin-contract","matched_impact_tags":["test.standalone"],"ordinal":9,"origin_evidence_digest":null,"origin_run_id":null,"reason_codes":["SOURCE_INPUT_CHANGED"]},{"affected":true,"decision":"EXECUTE","estimated_duration_ms":2746,"expected_fingerprint":"02dd926815099d3794c7ba33faf6bfa95d078bc66c5a931641735f492e92da60","id":"standalone.settings-schema","matched_impact_tags":["test.standalone"],"ordinal":10,"origin_evidence_digest":null,"origin_run_id":null,"reason_codes":["SOURCE_INPUT_CHANGED"]},{"affected":true,"decision":"EXECUTE","estimated_duration_ms":2550,"expected_fingerprint":"1716c2562116e894acd62aa490ceba39300433bfa016c4aa67454a51284bf980","id":"standalone.crash-handling","matched_impact_tags":["test.standalone"],"ordinal":11,"origin_evidence_digest":null,"origin_run_id":null,"reason_codes":["SOURCE_INPUT_CHANGED"]},{"affected":true,"decision":"EXECUTE","estimated_duration_ms":28724,"expected_fingerprint":"b0a12df498805b785cd74cd1538368a4dc44474c12e4ca8e929d44d93265721b","id":"perf.performance-tests2","matched_impact_tags":["test.perf","test.performance"],"ordinal":12,"origin_evidence_digest":null,"origin_run_id":null,"reason_codes":["SOURCE_INPUT_CHANGED"]},{"affected":true,"decision":"EXECUTE","estimated_duration_ms":139402,"expected_fingerprint":"342e27e8f846b8b88d81efa4598a71d3d69d3385d43f235a1d7ea261ad0f2c17","id":"tooling.pester","matched_impact_tags":["test.tooling"],"ordinal":13,"origin_evidence_digest":null,"origin_run_id":null,"reason_codes":["SOURCE_INPUT_CHANGED"]},{"affected":true,"decision":"EXECUTE","estimated_duration_ms":2549,"expected_fingerprint":"095ca598b5f68e03b6986b74e1b2dea08efba29e8209fa8b53fc14c270131567","id":"tooling.vcpkg-merge-synthetic","matched_impact_tags":["test.tooling"],"ordinal":14,"origin_evidence_digest":null,"origin_run_id":null,"reason_codes":["SOURCE_INPUT_CHANGED"]}],"estimated_avoided_duration_ms":0,"estimated_executed_duration_ms":1095932,"estimated_fresh_duration_ms":1095932,"matched_impact_rules":["documentation.docs","documentation.specs","fallback.unknown","fileops.selftests"],"plan_digest":"95e7d963ce839033c1052333e03b351b84b89bb3d96d37651b1bdf5b252868bd","planner_mode":"shadow","schema":"red-salamander.validation-plan-decision.v1","snapshot_id":"9ee4a49792bb88d7e88281207256cce46d94fd08687d2eb9364874bc0b7f7b1b"}
